url,date,author,title,subtitle,text
https://g1.globo.com/mundo/noticia/2024/05/21/espanha-anuncia-que-retirada-definitiva-de-embaixadora-na-argentina.ghtml, 21/05/2024 08h56 ,g1,espanha retira embaixadora da argentina de forma definitiva após fala de milei ,"crise diplomática entre os dois países escalou após presidente argentino se negar a pedir desculpa por chamar esposa de premiê espanhol de corrupta. milei criticou retirada, que chamou de resposta desproporcional. "," a espanha anunciou nesta terça-feira (21) que vai retirar de forma definitiva sua embaixadora na argentina, em um gesto que escala e aprofunda a crise diplomática entre os dois países.    a crise começou após o presidente argentino, javier milei, chamar a esposa do primeiro-ministro espanhol, pedro sánchez, de corrupta por conta de uma investigação arquivada contra ela (leia mais abaixo). madri, como reação, convocou sua embaixadora em buenos aires e exigiu pedido de desculpas por parte de milei.   na segunda-feira (20), no entanto, o presidente argentino aumentou a aposta da briga e disse que não se desculparia.   nesta manhã, o ministro das relações exteriores, josé manuel albares, anunciou então a retirada permanente de sua embaixadora em buenos aires. ""nossa embaixadora ficará definitivamente em madri, e a argentina continuará sem embaixadora"", disse albares.  com o movimento, a embaixada da espanha na argentina passa a funcionar apenas como uma representação de negócios entre os dois países.   o chanceler espanhol afirmou que o gesto de milei foi um ""assalto à boa fé e à hospitalidade"" da espanha, em referência à visita que o presidente argentino fez a madri na semana passada.   milei foi participar de um evento organizado pela extrema direita espanhola e não se encontrou com o premiê nem com o rei da espanha, que é o chefe de estado do país.  ""mesmo assim, acolhemos o presidente argentina da forma como devemos fazer com um presidente da argentina, que é uma república irmã da espanha. permitimos que ele aterrizasse e decolasse da base de torrejón de ardoz (base militar por onde chegam chefes de governo e estado em visitas oficiais), oferecendo garantias de segurança. e a resposta foi um ataque frontal com insultos a nossas instituições"", disse o chanceler.   javier milei criticou a retirada da embaixadora, que chamou de reposta desproporcional.   na segunda-feira, ao comentar a crise, o premiê espanhol já havia afirmado que a reação de seu governo seria proporcional ""à dignidade que representa a democracia espanhola e aos laços de irmandade que unem"" os dois países.  milei chama esposa de sánchez de corrupta  milei se referiu à esposa de pedro sánchez como uma ""mulher corrupta"" durante a convenção ""europa viva 24"", um evento de líderes da extrema direita organizado pelo partido espanhol vox, em madri, durante o fim de semana.  ""as elites globais não percebem o quão destrutivo pode ser implementar as ideias do socialismo (...), mesmo que você tenha a esposa corrupta, digamos, suja-se [sic] e tire cinco dias para pensar sobre isso"", disse milei, em referência a um período de cinco dias de reflexão que sánchez anunciou no fim de abril para decidir se renunciaria diante de acusações contra sua esposa.   em abril, a justiça espanhola aceitou uma denúncia contra a esposa do premiê, begonã gómez, feita pela associação manos limpias, um coletivo ligado à extrema direita que sánchez acusa de estar perseguindo sua família há anos.   a manos limpias acusou gómez de tráfico de influência e corrupção empresarial. no entanto, o ministério público arquivou depois a investigação com a alegação de que as provas apresentadas -- informações da imprensa indiretamente relacionadas à esposa de sánchez -- não eram suficientes.   segundo o portal espanhol ""el confidencial"", a investigação envolvia os vínculos de begoña gómez com o grupo turístico espanhol globalia, proprietário da companhia aérea air europa, quando esta última estava em negociações com o governo para obter um resgate durante a pandemia de covid-19, o que acabou conseguindo. "
https://oglobo.globo.com/brasil/sao-paulo/noticia/2024/05/21/adolescente-que-matou-familia-diz-nao-se-arrepender-e-admite-ter-pensado-no-crime-antes-de-comete-lo-faria-novamente.ghtml, 21/05/2024 00h01 ,luisa bertola,adolescente que matou família diz não se arrepender e admite ter pensado no crime antes de cometê-lo, corpos dos pais e da irmã já estavam em decomposição e tinham marcas de tiros quando a polícia chegou ao local," o adolescente de 16 anos apreendido após matar o pai, de 57 anos, a mãe, de 50, e a irmã, também de 16, na zona oeste de são paulo, na última sexta-feira, afirmou que não se arrepende em depoimento à polícia civil. o crime aconteceu dentro da casa em que a família vivia, onde o jovem permaneceu com os corpos até o domingo, quando acionou a polícia militar.  avenida faria lima: motorista de lamborghini atropela assaltante após roubo de relógio rolex em sp saiba quem era guilherme leon, cantor sertanejo que morreu em acidente na sp-270 após assinar 1º contrato da carreira  segundo o boletim de ocorrência, o adolescente afirma que cometeu o crime porque estava com raiva dos pais após eles terem confiscado seu celular. ele ainda conta que sempre teve desentendimentos com os pais, que eram adotivos.  caso anic: saiba quem é quem no caso da advogada desaparecida em petrópolis  stalker de mg acreditava ter relacionamento amoroso e frequentava mesmo lugares de médico perseguido, diz delegado  mau cheiro, lixo e lama: profissionais retomam limpeza de porto alegre com baixa gradativa do rio guaíba  como relatado pelo adolescente, o pai era membro da guarda civil de jundiaí e tinha uma arma em casa. ele sabia onde ficava escondida e fez um teste quando estava sozinho em casa. o disparo teria acertado no colchão da cama que os pais dormiam.  como aconteceu o crime?  na tarde de sexta-feira, ele esperou o pai chegar em casa após buscar a irmã do adolescente na escola. na cozinha, ele atirou contra o pai quando estava de costas. a irmã ouviu o barulho do disparo, foi até o local e também foi baleada no rosto. no depoimento, ele afirma que ""teve que matar a irmã"" porque ela estava no local.  reconstrução de nova orleans (eua) após katrina deixa erros e acertos como lição ao sulque dia é corpus christi? saiba se data é feriado ou ponto facultativo  o adolescente ainda relata que após matar os dois, almoçou no local e foi para a academia. ao voltar, esperou a mãe chegar, abriu o portão e a matou quando ela viu os corpos do marido e da filha na casa.  o que aconteceu com a arma do crime?  a arma usada no crime foi encontrada pelos agentes na mesa da sala e estava municiada. a pistola e a munição foram apreendidas.  corpo de mulher soterrada por deslizamento é encontrado após 18 dias de buscas, diz irmãenem 2024: alunos do rio grande do sul terão isenção e calendário especial para inscrição, diz ministro o adolescente confessou o crime?  foi o próprio adolescente quem acionou a polícia e confessou o crime na noite deste domingo. aos policiais, ele relatou que matou os familiares com a arma usada no trabalho do pai. os corpos de isac tavares santos, solange aparecida gomes e letícia gomes santos já estavam em decomposição e tinham marcas de tiros quando a polícia chegou ao local.   ele foi apreendido por homicídio e feminicídio, e o caso foi registrado no 33º dp (pirituba) como ato infracional de homicídio e feminicídio; ato infracional de posse ou porte ilegal de arma de fogo e ato infracional de vilipêndio a cadáver. segundo a secretária de segurança pública, ele foi encaminhado para à fundação casa. "
https://oglobo.globo.com/politica/noticia/2024/05/21/bolsonaro-e-braga-netto-recorrem-ao-stf-para-tentar-reverter-inelegibilidade-por-eventos-de-sete-de-setembro.ghtml, 21/05/2024 10h41 ,paolla serra,bolsonaro e braga netto recorrem ao stf para tentar reverter inelegibilidade por eventos de sete de setembro,"ex-presidente e ex-ministro foram condenados pelo tse por abuso de poder político e econômico, ao misturarem o cerimônia oficial com ato de campanha"," a defesa do ex-presidente jair bolsonaro (pl) e do então candidato a vice em sua chapa, o ex-ministro da casa civil walter braga netto, apresentaram novo recurso para tentar reverter a inelegibilidade imposta aos dois pelo tribunal superior eleitoral (tse). o pedido, protocolado na última quinta-feira, é para que o caso seja enviado para análise do supremo tribunal federal (stf).   inelegibilidade de bolsonaro, cassação por fake news: veja ações que marcaram presidência de alexandre de moraes no tseentenda: pgr pede rejeição de recurso de bolsonaro contra condenação no tse  bolsonaro e braga netto foram condenados por abuso de poder político e econômico, ao misturarem o evento oficial com um ato de campanha durante as comemorações do bicentenário da independência, no sete de setembro de 2022. com a decisão, foi declarada a inelegibilidade de ambos por oito anos, contados a partir do pleito de 2022.   no início do mês, o tse rejeitou os embargos que haviam sido apresentados à própria corte.    essa foi a segunda condenação de bolsonaro. em junho do ano passado, o tse já havia condenado o ex-presidente por ataques ao sistema eleitoral realizados em uma reunião com embaixadores. bolsonaro já recorreu contra esse resultado ao stf, mas ainda não houve um julgamento.   o recurso sobre essa decisão do tse já chegou ao stf. inicialmente, o caso ficou sob a relatoria do ministro cristiano zanin, mas ele se declarou impedido de atuar, porque foi advogado do presidente luiz inácio lula da silva (pt) na eleição de 2022. agora, o processo está com luiz fux.   caso uma das duas condenações seja derrubada, a outra segue valendo. no caso de braga netto, há apenas uma condenação. "
https://extra.globo.com/mundo/noticia/2024/05/casal-de-jovens-britanicos-decide-viver-a-vida-como-nos-anos-1940.ghtml, 21/05/2024 04h31 ,redação extra,casal de jovens britânicos decide viver a vida como nos anos 1940,"eles evitam tecnologia, vestem roupas tradicionais, decoraram a casa com móveis de época, frequentam bailes, tiram férias temáticas e herdaram um carro de 1942"," o casal liberty avery, de 24 anos, e greg kirby, 29, do vilarejo de ditchingham, no condado de nortfolk, no reino unido, escolheu viver como se estivesse na década de 1940. da cerimônia de casamento, que teve como tema o período histórico, aos hábitos do dia a dia e a decoração da casa, tudo é inspirado no modelo que os avós deles viveram, disseram em entrevista à bbc.  marido fantasma: cantora britânica diz ter sido traída e perseguida após casar com fantasma e 'adotar' boneco de palhaço, nos euaveja: peixe-futebol que brilha nas profundezas do mar é avistado na costa de oregon, nos eua  — tentamos fazer com que nosso casamento fosse o mais tradicional possível, como os anos 1940, como talvez nossos avós tivessem feito — disse kirby, que trabalha como barbeiro, e acrescenta — é apenas uma vida simples, na verdade. eles (os avós) não gastavam uma quantia enorme, então nós também não.   a união foi celebrada na igreja, e, claro, com roupas e fotografia da década pela qual são apaixonados. depois, foram a um pub para comer e estenderam as comemorações a um salão da vila. eles afirmam que a lua de mel de uma semana em brighton também seguiu os ritos de época, assim como as outras viagens de férias que organizam.   segundo eles, o tempo que dedicam à tecnologia, algo difícil de se desvencilhar atualmente, é cada vez mais limitado. preferem os jogos de tabuleiro e os bailes tradicionais no fim de semana, praticando as danças de 1940 em uma aula em que se matricularam.   entre tantas peculiaridades, o traço mais marcante é o vestuário. todos os dias eles usam roupas retrô, e o trabalho de liberty como costureira vintage ajuda a manter o estilo. além de costurar, ela gosta de cozinhar usando receitas e utensílios da época.   — achamos as roupas daquela época confortáveis ​​e duradouras. isso significa que você não está apenas comprando roupas para a estação e jogando fora. gostamos de tentar consertar as roupas, dar uma nova vida, e elas ficam tão boas quanto eram há 80 anos — afirma kirby, embora admita que é um desafio cuidar de tecidos velhos e delicados.   para completar o modo de vida para lá de excêntrico, eles herdaram um jipe ​​​​americano de 1942. mas a costureira confessa que não vivem só de passado e que pequenas pausas podem ser bem-vindas, como ao escolherem um filme para assistir.   — os filmes antigos podem ser bastante pesados, por isso greg nos incentiva a assistir algo mais recente de vez em quando — revela liberty.   os jovens se conheceram quando liberty ainda era aprendiz em um salão de cabeleireiro onde o marido era cliente. para eles, o amor pelos anos 1940 cresceu ao longo do relacionamento.   — ele não conseguiu se livrar de mim desde então — conta ela sorrindo. "
https://oglobo.globo.com/mundo/noticia/2024/05/21/110-mil-toneladas-de-diplomacia-entenda-o-que-a-visita-de-um-superporta-avioes-revela-sobre-a-relacao-dos-eua-com-o-brasil.ghtml, 21/05/2024 10h00 ,thayz guimarães,‘110 mil toneladas de diplomacia’: entenda o que a visita de um superporta-aviões revela sobre a relação dos eua com o brasil,"terceira missão do uss george washington na américa latina dá sinais de crescente interesse pelo atlântico sul num contexto de polarização com pequim, dizem analistas"," uma das peças centrais das forças navais dos estados unidos, o gigante uss george washington (cvn-73) está de volta às águas brasileiras. em sua terceira missão na américa latina e região do caribe, o superporta-aviões com propulsão nuclear participará, nos próximos meses, da operação southern seas 2024 antes de seguir para o japão, onde deve chegar entre setembro e outubro para operar por mais 25 anos. a viagem, iniciada em 5 de abril, marca o retorno da embarcação para a base naval de yokosuka — após uma série de atrasos. mas também dá sinais de um crescente interesse pelo atlântico sul num contexto de forte polarização entre washington e pequim, cujo principal cenário de disputas hoje se dá na região do pacífico, afirmam analistas ouvidos por o globo.   — a china tem feito movimentos fortes de aproximação militar com os países da costa ocidental da áfrica e econômicos e políticos com os países da américa do sul, entre eles o brasil. com esse avanço, os americanos começaram a se preocupar mais com o atlântico sul — diz francisco novellino, oficial superior reformado da marinha do brasil e analista de defesa e poder naval. — operações de forças navais americanas com brasil e outros países da região não são novidade, ocorrem há décadas, mas agora estão dando um recado maior.  'cidade' flutuante: conheça o uss george washington, o superporta-aviões dos eua com propulsão nuclear que está no rionova era do poder naval: expansão chinesa eleva tensão na região do indo-pacífico  a última vez que o george washington esteve no brasil foi em 2015, durante a operação unitas, o mais antigo exercício marítimo multinacional organizado pelos eua. na ocasião, militares brasileiros e americanos realizaram treinamentos conjuntos, incluindo simulações de combate aéreo entre caças da força aérea brasileira e da marinha americana.   agora, estão previstos exercícios de passagem e operações no mar com as forças marítimas de nações parceiras, que acontecerão ao longo da circunavegação do continente sul-americano. além do brasil, a companhia de navios do george washington — que inclui submarinos, destróieres e navios de reabastecimento — participará de compromissos com argentina, chile, colômbia, equador, peru e uruguai, com visitas a portos planejadas para as cidades de rio de janeiro, valparaíso e el callao.  sem fronteiras marítimas definidas: países entram na briga por recursos naturais e rotas de comércio bilionárias  — esse tipo de exercício faz parte da chamada diplomacia de defesa, que é extremamente importante nas questões relacionadas às disputas entre grandes potências e na diplomacia como um todo. é uma maneira de um país tentar influenciar outros, de construir alianças — explica o almirante da reserva antonio ruy de almeida silva, pesquisador sênior do instituto de estudos estratégicos da universidade federal fluminense.   exemplo disso é que, pela primeira vez, a southern seas tem uma equipe internacional embarcada. são aproximadamente 25 oficiais de 13 nações parceiras que estão servindo a bordo do uss george washington. segundo a marinha americana, o objetivo é oferecer instruções de professores da escola de guerra naval dos eua e trabalhar juntamente com pessoal embarcado para conduzir um planejamento operacional detalhado em apoio às operações no mar, visando aprimorar a capacidade, melhorar a interoperabilidade e fortalecer parcerias marítimas com países em toda a área de responsabilidade do comando sul dos eua.  'ferro-velho marítimo': descarte ilegal de navios movimenta mercado lucrativo ao custo de mortes e poluição no sul da ásia  o brasil participa com dois oficiais, o comandante emanuel ramos ferreira e o capitão de corveta rodrigo silva, ambos do estado-maior. eles embarcaram em 29 de abril na estação naval de mayport, na flórida, e seguirão viagem com a tripulação até el callao, no peru, onde o desembarque está previsto para 21 de junho.   porta-aviões são geralmente os maiores — e mais caros — navios operados pelas marinhas de guerra. sua principal função é apoiar e operar aeronaves que realizam ataques a alvos aéreos, flutuantes e em terra durante operações de projeção de poder sustentado, servindo como uma espécie de pista de pouso e decolagem capaz de se deslocar rapidamente pelo mar, dispensando assim aeroportos ou instalações convencionais.   em funcionamento desde 1992, o uss george washington foi o primeiro porta-aviões com propulsão nuclear americano permanentemente estacionado fora do território continental dos eua a partir de 2008. em 2017, ele regressou para norfolk, no estado da virgínia, onde passou por processos de reabastecimento e revisão de meia-vida que, em meio a limitações orçamentárias e atrasos dos mais diversos tipos — incluindo a pandemia de covid-19 —, só foram concluídos em maio de 2023, a um custo estimado de mais de us$ 2,8 bilhões (r$ 14,3 bilhões).  análise: por que é importante para o brasil ter um submarino nuclear?  popularmente conhecido como gw, o uss george washington mede 330 metros de comprimento por 78 metros de largura (40,8 metros na linha d'água) e desloca cerca de 110 mil toneladas no mar. da quilha até o topo do mastro, são 74 metros de altura, o equivalente a um prédio de aproximadamente 24 andares. seu interior comporta dez pisos acima do convés e outros dez abaixo, interligados por mais de 50 escadas. além disso, tem capacidade para receber uma tripulação de cerca de 5 mil militares — o equivalente à população inteira de uma pequena cidade. atualmente, estão embarcados 4,9 mil tripulantes, sendo mais de 3 mil alistados na companhia de navios e 1.450 na ala aérea, além de 250 oficiais da ala aérea e 200 da companhia de navios.   — são 110 mil toneladas de diplomacia no mar, além de representar um dos mais avançados e poderosos meios de projeção de poder marítimo do mundo — comenta leonam guimarães, engenheiro naval, oficial da reserva e diretor-técnico da associação brasileira para desenvolvimento atividades nucleares (abdan).   o superporta-aviões americano ainda possui dois reatores nucleares, que geram energia para alimentar as quatro hélices que movimentam o navio, bem como o restante da embarcação, incluindo os elevadores (que levam as aeronaves do hangar para o convés em apenas oito segundos), as catapultas para lançamento dos caças (que atingem uma velocidade de quase 2.000 km/h em instantes) e os cabos de retenção (responsáveis por frear as aeronaves no pouso). sua ala aérea de bordo é composta por cerca de 90 aviões e helicópteros divididos em nove esquadrões — as aeronaves são as principais armas dos porta-aviões, servindo também para defesa da força-tarefa.   — o porta-aviões não é apenas um navio, é uma combinação de poder aéreo com poder naval, ou seja, sua capacidade de serviço é multiplicada. e a marinha dos eua descobriu que não existe ferramenta melhor para lutar num teatro de grandes proporções como o pacífico do que um porta-aviões — conclui felipe salles, mestre em estudos marítimos. "
